{
  "version": "2.0",
  "kind": "codebase",
  "repo_id": "sample",
  "repo_meta": {
    "id": "sample",
    "path": "../../sample-repo",
    "git_remote": "",
    "git_commit_hash": "unknown",
    "languages": [
      "markdown",
      "typescript"
    ],
    "frameworks": [],
    "primary_language": "markdown",
    "description": "v2.0 sample single-repo workspace"
  },
  "nodes": [
    {
      "id": "sample::doc-README-md",
      "repo_id": "sample",
      "type": "document",
      "name": "README.md",
      "filePath": "README.md",
      "summary": "由 Understand-Anything 确定性扫描发现的 markdown docs 文件。",
      "tags": [
        "markdown",
        "docs",
        "understand-anything"
      ],
      "complexity": "simple",
      "evidence_refs": [
        {
          "repo_id": "sample",
          "file": "README.md",
          "source": "engine",
          "extracted_at": "2026-05-27T15:25:12.453Z"
        }
      ],
      "confidence": "high"
    },
    {
      "id": "sample::file-src-app-ts",
      "repo_id": "sample",
      "type": "file",
      "name": "src/app.ts",
      "filePath": "src/app.ts",
      "summary": "由 Understand-Anything 确定性扫描发现的 typescript code 文件。",
      "tags": [
        "typescript",
        "code",
        "understand-anything"
      ],
      "complexity": "simple",
      "evidence_refs": [
        {
          "repo_id": "sample",
          "file": "src/app.ts",
          "source": "engine",
          "extracted_at": "2026-05-27T15:25:12.453Z"
        }
      ],
      "confidence": "high"
    },
    {
      "id": "sample::func-src-app-ts-answer",
      "repo_id": "sample",
      "type": "function",
      "name": "answer",
      "filePath": "src/app.ts",
      "lineRange": [
        1,
        3
      ],
      "summary": "函数 answer,由 Understand-Anything 结构抽取识别。",
      "tags": [
        "typescript",
        "function",
        "understand-anything"
      ],
      "complexity": "simple",
      "evidence_refs": [
        {
          "repo_id": "sample",
          "file": "src/app.ts",
          "source": "engine",
          "extracted_at": "2026-05-27T15:25:12.453Z",
          "line_range": [
            1,
            3
          ]
        }
      ],
      "confidence": "high"
    }
  ],
  "edges": [
    {
      "source": "sample::file-src-app-ts",
      "target": "sample::func-src-app-ts-answer",
      "type": "contains",
      "direction": "forward",
      "weight": 1
    }
  ],
  "layers": [
    {
      "id": "sample-layer-docs",
      "name": "docs",
      "description": "由 Understand-Anything fileCategory=docs 归类的节点。",
      "node_ids": [
        "sample::doc-README-md"
      ]
    },
    {
      "id": "sample-layer-code",
      "name": "code",
      "description": "由 Understand-Anything fileCategory=code 归类的节点。",
      "node_ids": [
        "sample::file-src-app-ts"
      ]
    }
  ],
  "tour": [],
  "freshness": {
    "status": "fresh",
    "reason": "fingerprint generated from current scanned files"
  },
  "scan_meta": {
    "engine_version": "2.0.0-skeleton",
    "based_on": "Understand-Anything scan-project/extract-import-map/extract-structure",
    "scanned_at": "2026-05-27T15:25:12.453Z",
    "files_scanned": 2,
    "languages_detected": [
      "markdown",
      "typescript"
    ],
    "upstream_scan": {
      "total_files": 2,
      "filtered_by_ignore": 0,
      "estimated_complexity": "small",
      "import_edges": 0,
      "structure_files_analyzed": 2,
      "structure_files_skipped": []
    }
  },
  "known_unknowns_repo": []
}
